{
  "event_id": "00000000-0000-4000-8000-000000000001",
  "event_type": "customer_transaction",
  "schema_version": "1.0",
  "source": "historical_customer_generator",
  "event_timestamp": "2026-01-15T12:00:00Z",
  "source_timestamp": "2026-01-15T12:00:01Z",
  "ingestion_timestamp": "2026-01-15T12:00:02Z"
}
